{
  "device_id": "process-flow",
  "device_type": "flow",
  "description": "A directional process diagram showing how work, data, or users move through a system.",
  "best_for_classes": [
    "operating-model",
    "solution-mechanics",
    "go-to-market"
  ],
  "best_for_data_shapes": [
    "journey",
    "roadmap"
  ],
  "not_for": [
    "valuation-npv"
  ],
  "typical_role": "hero",
  "notes": [
    "Use when the main question is how the system works.",
    "Keep steps directional and visibly ordered."
  ]
}
